{
  "schema_version": "account_reconcile_panel.v1",
  "workbench": "Account Workbench",
  "panel": "Account Reconcile Panel",
  "route": "/accounts/{account_id}/reconcile",
  "fixture_state": "matched",
  "context": {
    "trading_day": "2026-06-14",
    "session_id": "account-workbench.fixture.20260614.006",
    "run_id": "account-reconcile.fixture.matched.001",
    "reducer_checkpoint_id": "account-reconcile.checkpoint.matched.001",
    "reducer_checkpoint_ts": "2026-06-14T15:34:16Z",
    "stream_state": "healthy",
    "projection_owner": "account-console-contracts",
    "source_authority": "deterministic_fixture"
  },
  "account": {
    "account_id": "acct.demo-19053",
    "account_alias": "19053",
    "account_kind": "real_feed_sandbox_paper"
  },
  "reconcile_items": [
    {
      "item_id": "reconcile.cash.001",
      "category": "cash",
      "severity": "info",
      "status": "matched",
      "expected_value": 98240.5,
      "observed_value": 98240.5,
      "delta": 0.0,
      "tolerance_ref": "fixture://account-workbench/reconcile/tolerance/cash-v1",
      "mismatch_ref": null,
      "owner": "account-console-contracts",
      "next_action": "keep displaying source refs only",
      "source_ref": "fixture://account-workbench/reconcile/acct.demo-19053/matched/cash",
      "checksum": "sha256:b1b1b1b1b1b1b1b1b1b1b1b1b1b1b1b1b1b1b1b1b1b1b1b1b1b1b1b1b1b1b1b1"
    }
  ],
  "blockers": [],
  "source_refs": [
    {
      "kind": "reconcile_projection",
      "owner": "account-console-contracts",
      "source_ref": "fixture://account-workbench/reconcile/acct.demo-19053/matched",
      "checksum": "sha256:b2b2b2b2b2b2b2b2b2b2b2b2b2b2b2b2b2b2b2b2b2b2b2b2b2b2b2b2b2b2b2b2",
      "authority": "deterministic reconcile fixture; not ledger truth"
    }
  ],
  "boundaries": {
    "read_only_projection": true,
    "runtime_truth": false,
    "account_truth": false,
    "order_truth": false,
    "ledger_truth": false,
    "ui_truth": false,
    "paper_ready": false,
    "live_ready": false,
    "broker_tradable": false,
    "admission_truth": false,
    "capital_truth": false,
    "action_controls": false
  },
  "rejection_rules": [
    "Reject this fixture as reconcile or ledger authority.",
    "Reject styling-only mismatch handling without owner and next_action refs."
  ]
}
